{
  "attempts" : [
    {
      "derivedMetrics" : {
        "decodeTokensPerSecond" : 20.63429676533881,
        "firstRenderableProxyTTFTMilliseconds" : 1192.448791,
        "pipelineTTFTMilliseconds" : 1167.374709,
        "prefillTokensPerSecond" : 59.97844177730501,
        "processPhysicalFootprintMiB" : 1883.2210235595703,
        "requestCompletionMilliseconds" : 2910.753333
      },
      "generatedText" : "Your note is safely saved on this iPhone and will automatically sync when you have a connection again. Just give it a little time, and it'll be back in your notes.",
      "memorySamples" : [
        {
          "elapsedNanoseconds" : 25250,
          "physicalFootprintBytes" : 1854605576
        },
        {
          "elapsedNanoseconds" : 52297292,
          "physicalFootprintBytes" : 1859586312
        },
        {
          "elapsedNanoseconds" : 105714959,
          "physicalFootprintBytes" : 1943488848
        },
        {
          "elapsedNanoseconds" : 159216667,
          "physicalFootprintBytes" : 1946143056
        },
        {
          "elapsedNanoseconds" : 212688792,
          "physicalFootprintBytes" : 1949583696
        },
        {
          "elapsedNanoseconds" : 266148042,
          "physicalFootprintBytes" : 1952172368
        },
        {
          "elapsedNanoseconds" : 321399000,
          "physicalFootprintBytes" : 1932249424
        },
        {
          "elapsedNanoseconds" : 372286000,
          "physicalFootprintBytes" : 1934395728
        },
        {
          "elapsedNanoseconds" : 422910834,
          "physicalFootprintBytes" : 1937475920
        },
        {
          "elapsedNanoseconds" : 476543209,
          "physicalFootprintBytes" : 1939573072
        },
        {
          "elapsedNanoseconds" : 530038042,
          "physicalFootprintBytes" : 1941670224
        },
        {
          "elapsedNanoseconds" : 583660875,
          "physicalFootprintBytes" : 1942718800
        },
        {
          "elapsedNanoseconds" : 637281084,
          "physicalFootprintBytes" : 1944815952
        },
        {
          "elapsedNanoseconds" : 690709209,
          "physicalFootprintBytes" : 1946814800
        },
        {
          "elapsedNanoseconds" : 741296834,
          "physicalFootprintBytes" : 1948928336
        },
        {
          "elapsedNanoseconds" : 794781250,
          "physicalFootprintBytes" : 1951025488
        },
        {
          "elapsedNanoseconds" : 846218292,
          "physicalFootprintBytes" : 1973061968
        },
        {
          "elapsedNanoseconds" : 896824250,
          "physicalFootprintBytes" : 1973324112
        },
        {
          "elapsedNanoseconds" : 950237584,
          "physicalFootprintBytes" : 1973520720
        },
        {
          "elapsedNanoseconds" : 1003718792,
          "physicalFootprintBytes" : 1973782864
        },
        {
          "elapsedNanoseconds" : 1057233792,
          "physicalFootprintBytes" : 1974061392
        },
        {
          "elapsedNanoseconds" : 1110674084,
          "physicalFootprintBytes" : 1974061392
        },
        {
          "elapsedNanoseconds" : 1164160584,
          "physicalFootprintBytes" : 1974225232
        },
        {
          "elapsedNanoseconds" : 1215068750,
          "physicalFootprintBytes" : 1974651216
        },
        {
          "elapsedNanoseconds" : 1268498584,
          "physicalFootprintBytes" : 1974651216
        },
        {
          "elapsedNanoseconds" : 1318884584,
          "physicalFootprintBytes" : 1974651216
        },
        {
          "elapsedNanoseconds" : 1370281959,
          "physicalFootprintBytes" : 1974651216
        },
        {
          "elapsedNanoseconds" : 1423718750,
          "physicalFootprintBytes" : 1974634832
        },
        {
          "elapsedNanoseconds" : 1477173084,
          "physicalFootprintBytes" : 1974651216
        },
        {
          "elapsedNanoseconds" : 1529275500,
          "physicalFootprintBytes" : 1974651216
        },
        {
          "elapsedNanoseconds" : 1581662250,
          "physicalFootprintBytes" : 1974667600
        },
        {
          "elapsedNanoseconds" : 1633755000,
          "physicalFootprintBytes" : 1974683984
        },
        {
          "elapsedNanoseconds" : 1687191000,
          "physicalFootprintBytes" : 1974683984
        },
        {
          "elapsedNanoseconds" : 1738514667,
          "physicalFootprintBytes" : 1974683984
        },
        {
          "elapsedNanoseconds" : 1790590167,
          "physicalFootprintBytes" : 1974683984
        },
        {
          "elapsedNanoseconds" : 1844096084,
          "physicalFootprintBytes" : 1974700368
        },
        {
          "elapsedNanoseconds" : 1895819500,
          "physicalFootprintBytes" : 1974700368
        },
        {
          "elapsedNanoseconds" : 1947150959,
          "physicalFootprintBytes" : 1974700368
        },
        {
          "elapsedNanoseconds" : 2000647125,
          "physicalFootprintBytes" : 1974700368
        },
        {
          "elapsedNanoseconds" : 2054050959,
          "physicalFootprintBytes" : 1974700368
        },
        {
          "elapsedNanoseconds" : 2106479834,
          "physicalFootprintBytes" : 1974700368
        },
        {
          "elapsedNanoseconds" : 2159924834,
          "physicalFootprintBytes" : 1974700368
        },
        {
          "elapsedNanoseconds" : 2211984250,
          "physicalFootprintBytes" : 1974700368
        },
        {
          "elapsedNanoseconds" : 2264566667,
          "physicalFootprintBytes" : 1974667600
        },
        {
          "elapsedNanoseconds" : 2318048667,
          "physicalFootprintBytes" : 1974667600
        },
        {
          "elapsedNanoseconds" : 2370154000,
          "physicalFootprintBytes" : 1974667600
        },
        {
          "elapsedNanoseconds" : 2423567709,
          "physicalFootprintBytes" : 1974667600
        },
        {
          "elapsedNanoseconds" : 2477002000,
          "physicalFootprintBytes" : 1974667600
        },
        {
          "elapsedNanoseconds" : 2530420125,
          "physicalFootprintBytes" : 1974667600
        },
        {
          "elapsedNanoseconds" : 2583844584,
          "physicalFootprintBytes" : 1974667600
        },
        {
          "elapsedNanoseconds" : 2637337417,
          "physicalFootprintBytes" : 1974667600
        },
        {
          "elapsedNanoseconds" : 2690795334,
          "physicalFootprintBytes" : 1974667600
        },
        {
          "elapsedNanoseconds" : 2744222959,
          "physicalFootprintBytes" : 1974667600
        },
        {
          "elapsedNanoseconds" : 2797624750,
          "physicalFootprintBytes" : 1974683984
        },
        {
          "elapsedNanoseconds" : 2851089417,
          "physicalFootprintBytes" : 1974683984
        },
        {
          "elapsedNanoseconds" : 2903363209,
          "physicalFootprintBytes" : 1974683984
        },
        {
          "elapsedNanoseconds" : 2911574584,
          "physicalFootprintBytes" : 1974683984
        }
      ],
      "outcome" : "completed",
      "outputTokenCount" : 35,
      "promptTokenCount" : 70,
      "reasonCodes" : [

      ],
      "renderabilityTrace" : {
        "captureLimit" : 32,
        "clockOrigin" : "adapter-request-accepted",
        "entries" : [
          {
            "decodedAtNanoseconds" : 1192448791,
            "decodedPrefix" : "Your",
            "isRenderable" : true,
            "tokenID" : 7771,
            "tokenIndex" : 0,
            "tokenReceivedNanoseconds" : 1190935125
          }
        ],
        "firstRenderableTokenIndex" : 0,
        "generationStartNanoseconds" : 23560416,
        "outcome" : "firstRenderableFound",
        "policyVersion" : "first-renderable-decoded-prefix-v1",
        "scope" : "through-first-renderable-inclusive"
      },
      "responseConformance" : {
        "reasonCodes" : [

        ],
        "status" : "pass"
      },
      "role" : "warmup",
      "runIndex" : 0,
      "stopReason" : "endOfSequence",
      "thermal" : {
        "after" : "nominal",
        "before" : "nominal",
        "transitions" : [

        ]
      },
      "timingEvidence" : {
        "generationStartNanoseconds" : 23560416,
        "promptEvaluationNanoseconds" : 1167086005,
        "requestCompletionNanoseconds" : 2910753333
      },
      "tokenEvents" : [
        {
          "elapsedNanoseconds" : 1167374709,
          "index" : 0,
          "tokenID" : 7771
        },
        {
          "elapsedNanoseconds" : 1215318834,
          "index" : 1,
          "tokenID" : 5185
        },
        {
          "elapsedNanoseconds" : 1263381459,
          "index" : 2,
          "tokenID" : 374
        },
        {
          "elapsedNanoseconds" : 1311297459,
          "index" : 3,
          "tokenID" : 21000
        },
        {
          "elapsedNanoseconds" : 1359656084,
          "index" : 4,
          "tokenID" : 6781
        },
        {
          "elapsedNanoseconds" : 1409021667,
          "index" : 5,
          "tokenID" : 389
        },
        {
          "elapsedNanoseconds" : 1459487834,
          "index" : 6,
          "tokenID" : 419
        },
        {
          "elapsedNanoseconds" : 1505852667,
          "index" : 7,
          "tokenID" : 12167
        },
        {
          "elapsedNanoseconds" : 1553997250,
          "index" : 8,
          "tokenID" : 323
        },
        {
          "elapsedNanoseconds" : 1601980959,
          "index" : 9,
          "tokenID" : 686
        },
        {
          "elapsedNanoseconds" : 1650159959,
          "index" : 10,
          "tokenID" : 9463
        },
        {
          "elapsedNanoseconds" : 1698284709,
          "index" : 11,
          "tokenID" : 12811
        },
        {
          "elapsedNanoseconds" : 1746483625,
          "index" : 12,
          "tokenID" : 979
        },
        {
          "elapsedNanoseconds" : 1795220167,
          "index" : 13,